{
  "schema": "ai-peer-review.process-source-conformance/v1",
  "captureId": "source-1107b659033d899cdef30f408fbce16b",
  "hostId": "sha256:c98070aa1ea6c2bfbc72fe53cca254cb886ef4066c4da3e3c03a2f2a19eb9efc",
  "registrationDigest": "sha256:bb2ffee887059807f4789f890ed04a958f551ce80b5e2227f8174f31f9d81593",
  "registrationRevision": "d8ee60546b20be061f117d99b7c591e87edbcb26",
  "registrationIndexDigest": "sha256:79d14246b69e990eb60203a6dfff343025dd03df3cd1141b72676b8909694ef9",
  "package": {
    "schema": "ai-peer-review.process-source-package/v1",
    "sourceCommit": "7d4223faf123716406c78b4fa9d0ffa553f4c73c",
    "tarballDigest": "sha256:ebfb15c0515f29ad9315ead4ac39c5c8d85eb28b46ea46286fc2f81e63d6f367",
    "inventoryDigest": "sha256:262ecbb6f04b37c8aca2cf6c4b42e251e201bbfb370df39e535a2a0f1043f050",
    "contractDigest": "sha256:424f35d0c9e24283d43ddc3550ed4923fdc444219331cd5fe39aa676c043fedb"
  },
  "scope": {
    "platform": "linux",
    "build": "6.17.0-1022-azure",
    "architecture": "x64",
    "nodeMajor": 24,
    "probe": {
      "path": "/proc",
      "visibility": "full-pid-namespace",
      "errorContract": "exact-pid-directory-v1",
      "version": "procfs-v1"
    }
  },
  "kind": "absence",
  "controls": {
    "producer": {
      "kind": "installed-source",
      "contractDigest": "sha256:424f35d0c9e24283d43ddc3550ed4923fdc444219331cd5fe39aa676c043fedb",
      "inventoryDigest": "sha256:262ecbb6f04b37c8aca2cf6c4b42e251e201bbfb370df39e535a2a0f1043f050"
    },
    "live": {
      "pid": 3600,
      "nonce": "784d1e74af28832fbda401b0483447a54d899a33cff9db0bd8aa60d1190fea3b",
      "creation": {
        "unit": "linux-ticks:f374162b-1486-4486-9677-71a48f9cc758",
        "lower": "98349",
        "upper": "98350"
      }
    },
    "exit": {
      "pid": 3600,
      "exitCode": 0,
      "signal": null
    },
    "absence": {
      "pid": 3600,
      "status": "absent"
    },
    "error": {
      "status": "unknown",
      "reason": "probe-access-error"
    },
    "cleanup": {
      "childExited": true,
      "restoration": "not-required"
    }
  },
  "transitions": [],
  "boot": {
    "before": "f374162b-1486-4486-9677-71a48f9cc758",
    "after": "f374162b-1486-4486-9677-71a48f9cc758"
  },
  "signature": {
    "algorithm": "Ed25519",
    "keyId": "sha256:202b576b6652944fea913afc39f951c49f4f1b7998af7e377867dbfd01e54667",
    "value": "47708c7ad565832d23a34b3088f686ac5be26e76425b7104af2decc53bb9086a38586648b8fd15e62412744006f815e54dff28cf3cc4f9dcc56d88cb88c0a907"
  }
}
