{
  "schema": "ai-peer-review.process-source-conformance/v1",
  "captureId": "source-f8bd19ba6d2754392c1bb344c25361ac",
  "hostId": "sha256:788342eb2b73bdf41007f2300cd86c2389e05cfdaff914bd386c39b489a068a0",
  "registrationDigest": "sha256:77fd4e59a69305991ddd5d6a21e7bc2ccef04d8e31bdc7dd624df38a906d8846",
  "registrationRevision": "663b7ff65197375e152e9ace3a0e48fa0c10c567",
  "registrationIndexDigest": "sha256:6cbb6d92644c5263347f7b926edf9e992b8e7bc0790f101ed12af5b0c09b15a9",
  "package": {
    "schema": "ai-peer-review.process-source-package/v1",
    "sourceCommit": "11c83fa0c1b01448719bbbb336d41296fd17ec91",
    "tarballDigest": "sha256:55d4c05b08579f4abba694a25f6f664fdb47ca9d4627ea92df689cd244d95381",
    "inventoryDigest": "sha256:e3c4c6c16b3b74e0a955a913f840f10dbb228be515d1bde2b4ee7a5cd2fb62c3",
    "contractDigest": "sha256:505bc7fed2cd1b35874ab5bcb30a891f5d96a699fc08fedd932060b3d4601b0e"
  },
  "scope": {
    "platform": "win32",
    "build": "10.0.26100",
    "architecture": "x64",
    "nodeMajor": 26,
    "probe": {
      "path": "C:\\Windows\\System32\\WindowsPowerShell\\v1.0\\powershell.exe",
      "visibility": "local-cim-query",
      "errorContract": "completed-cim-query-v1",
      "version": "sha256:54b68d3922699817166ae7ddc4a18f7864fbe61c65f3c12b94ece0b3614b4366"
    }
  },
  "kind": "absence",
  "controls": {
    "producer": {
      "kind": "installed-source",
      "contractDigest": "sha256:505bc7fed2cd1b35874ab5bcb30a891f5d96a699fc08fedd932060b3d4601b0e",
      "inventoryDigest": "sha256:e3c4c6c16b3b74e0a955a913f840f10dbb228be515d1bde2b4ee7a5cd2fb62c3"
    },
    "live": {
      "pid": 7704,
      "nonce": "f97f70729c19bb90fe4053a2ae098f279d1198ab205d0163da707406e129a719",
      "creation": {
        "unit": "utc-nanoseconds",
        "lower": "1791681535318569000",
        "upper": "1791681535318569100"
      }
    },
    "exit": {
      "pid": 7704,
      "exitCode": 0,
      "signal": null
    },
    "absence": {
      "pid": 7704,
      "status": "absent"
    },
    "error": {
      "status": "unknown",
      "reason": "probe-query-error"
    },
    "cleanup": {
      "childExited": true,
      "restoration": "not-required"
    }
  },
  "transitions": [],
  "boot": {
    "before": null,
    "after": null
  },
  "signature": {
    "algorithm": "Ed25519",
    "keyId": "sha256:6bc9295479ba0b8c6fd642bd77796c0372b27e39e5905edff2c7cfca874f2bbe",
    "value": "158a1ffd1636022855f5152af60874ea37eb5dc20bb2cbc773792caaae0ba64ac11cc19d22df94a5016513899d4b9879fc90ef7daedcd5963be0f97a9e5e430d"
  }
}
