{
  "schema": "ai-peer-review.process-source-conformance/v1",
  "captureId": "source-91a4234506af2993bc176dd5b21df518",
  "hostId": "sha256:3ae2d1cc8fd60b80b3b4be341193d100ff69c652cec37dd0410277a1f6f423b6",
  "registrationDigest": "sha256:f8f0d06503b60aff5cea2578da7409439036a05e922c03582a5f5beb0ecd8bc7",
  "registrationRevision": "26ebc56a98702fb07dbe34d00a9abd325cabba12",
  "registrationIndexDigest": "sha256:e3c7d95c5f968f4f903735b0ce6f5bcb6bc8b890165c780864ea18722174a14b",
  "package": {
    "schema": "ai-peer-review.process-source-package/v1",
    "sourceCommit": "d50e64f9f778f70d4346d00d2e63d645c9e0edc3",
    "tarballDigest": "sha256:52dd0693763e6304463f9fbbbf67e1688cabfba9e728cca7f3dd066e1fe91e87",
    "inventoryDigest": "sha256:67d8977124f34864f4a2bf2d7e8b02d9e7f965d723c5da357d1adbf263d780d4",
    "contractDigest": "sha256:524b96e3e80bc4f448713ffaa1ea2a2f3f0ae8ec50722cb9072926b981690ae8"
  },
  "scope": {
    "platform": "win32",
    "build": "10.0.26100",
    "architecture": "x64",
    "nodeMajor": 24,
    "probe": {
      "path": "C:\\Windows\\System32\\WindowsPowerShell\\v1.0\\powershell.exe",
      "visibility": "local-cim-query",
      "errorContract": "completed-cim-query-v1",
      "version": "sha256:54b68d3922699817166ae7ddc4a18f7864fbe61c65f3c12b94ece0b3614b4366"
    }
  },
  "kind": "absence",
  "controls": {
    "producer": {
      "kind": "installed-source",
      "contractDigest": "sha256:524b96e3e80bc4f448713ffaa1ea2a2f3f0ae8ec50722cb9072926b981690ae8",
      "inventoryDigest": "sha256:67d8977124f34864f4a2bf2d7e8b02d9e7f965d723c5da357d1adbf263d780d4"
    },
    "live": {
      "pid": 8576,
      "nonce": "406f41e8ff2cddfac2ab4107b56388004f46e603a3c34eec44fed4d87da2e7ed",
      "creation": {
        "unit": "utc-nanoseconds",
        "lower": "1791444468508711000",
        "upper": "1791444468508711100"
      }
    },
    "exit": {
      "pid": 8576,
      "exitCode": 0,
      "signal": null
    },
    "absence": {
      "pid": 8576,
      "status": "absent"
    },
    "error": {
      "status": "unknown",
      "reason": "probe-query-error"
    },
    "cleanup": {
      "childExited": true,
      "restoration": "not-required"
    }
  },
  "transitions": [],
  "boot": {
    "before": null,
    "after": null
  },
  "signature": {
    "algorithm": "Ed25519",
    "keyId": "sha256:1fa410b67c76030b08e92c38ec29141c76af147e4a46f2d8b7c0aa33da3e1810",
    "value": "7fbf9b9cf72f0b50442f632bd293274e989d5b71fec1c675a48d4164711ccf332166785a03a2a5cf9bb3c759e87a20422f58afbdd4d0bef0abcc2d3c4bd11506"
  }
}
