{
  "schema": "ai-peer-review.process-source-conformance/v1",
  "captureId": "source-2ee00e1c52f7a510fa0acde71e41d314",
  "hostId": "sha256:2683c3ab0034fbfa8364989167c2178a3ae56999b64e383c69cbcddb10e758af",
  "registrationDigest": "sha256:231eaef4337f6251f649d8482f6d42b709b037997260846ce4f4ea31a5294f09",
  "registrationRevision": "eb3f5103ba8bf96fc924df599a59510b09dd7dd6",
  "registrationIndexDigest": "sha256:7cb1be22b3409af29cb8d3e88011f366e5f57ed7803b2302387d23a437546b5c",
  "package": {
    "schema": "ai-peer-review.process-source-package/v1",
    "sourceCommit": "07835545b0cd518a9e48667ed6fc4b9d13bdb6bc",
    "tarballDigest": "sha256:21331c1d1a9804d3d5cd4d7371d56866aeca54ed2d675a0a4c4f5dc325fdcf2f",
    "inventoryDigest": "sha256:dae2c97624b6a455b88923b2321d15c6d3232ff80201bbf35503e6f5996a51a5",
    "contractDigest": "sha256:340ece55ae98dcd5a8fb9cdd85b16138b0d0db3bcf44e55c13dc25b357dedb25"
  },
  "scope": {
    "platform": "darwin",
    "build": "25.6.0",
    "architecture": "arm64",
    "nodeMajor": 24,
    "probe": {
      "path": "/bin/ps",
      "visibility": "same-user-full-selection",
      "errorContract": "exact-ps-selection-v1",
      "version": "sha256:62c342e1351240eb62402b3fc8f7affed8d2d0bc8fa498df358dec09108b940f"
    }
  },
  "kind": "absence",
  "controls": {
    "producer": {
      "kind": "installed-source",
      "contractDigest": "sha256:340ece55ae98dcd5a8fb9cdd85b16138b0d0db3bcf44e55c13dc25b357dedb25",
      "inventoryDigest": "sha256:dae2c97624b6a455b88923b2321d15c6d3232ff80201bbf35503e6f5996a51a5"
    },
    "live": {
      "pid": 59230,
      "nonce": "f210d9c512b8606e6eadc123dedbd2fe877b06284ed47be49d88b34e51b93659",
      "creation": {
        "unit": "utc-nanoseconds",
        "lower": "1791783970000000000",
        "upper": "1791783971000000000"
      }
    },
    "exit": {
      "pid": 59230,
      "exitCode": 0,
      "signal": null
    },
    "absence": {
      "pid": 59230,
      "status": "absent"
    },
    "error": {
      "status": "unknown",
      "reason": "probe-query-error"
    },
    "cleanup": {
      "childExited": true,
      "restoration": "not-required"
    }
  },
  "transitions": [],
  "boot": {
    "before": null,
    "after": null
  },
  "signature": {
    "algorithm": "Ed25519",
    "keyId": "sha256:170fd9169e8e814371ca48150e945b8d414e6b0197b2a2c934b87c115ed537bc",
    "value": "7f17bdb721b560cfb2fdfb1dc6c9a373f828ebd23815cb378fd927807b71e7c73b7a56041f7e5236edb2150b9cccf3a3379a4884b0ab5dbd9a1c01692ee2a10a"
  }
}
